{
  "version": 1,
  "run_id": "2026-10-16T12:02:47Z",
  "git_sha": "b947485",
  "workflow_run_url": "https://github.com/ChrisAdkin8/atelier/actions/runs/38897662247",
  "all_passed": true,
  "status": "yellow",
  "calibration_phase": true,
  "floor": 0.95,
  "summaries": [],
  "providers_tested": [
    "anthropic:claude-haiku-4-5"
  ]
}
